id	lang	theme	kind	polarity	stem	choices	correct	explanation	source_ref	source_url	source_as_of	image
q-fr-prefetmaritime-37-cd8d3ce0	fr	reglementation	rule_mc	affirmative	Dans la bande littorale des 300 mètres à partir du rivage, à quelle vitesse la navigation est-elle en principe limitée ?	5 nœuds | 20 nœuds | Aucune limite de vitesse	A	Sauf disposition locale particulière, la vitesse est limitée à 5 nœuds dans la bande des 300 mètres, pour la sécurité des baigneurs.	Arrêté du préfet maritime (bande des 300 m, 5 nœuds) ; CGCT art. L.2213-23	https://www.premar-mediterranee.gouv.fr/		
q-fr-ripam-33-1fe861ab	fr	regles_route	rule_mc	affirmative	Dans un chenal étroit, de quel côté un navire doit-il en règle générale se tenir ?	Le bord du chenal situé sur sa droite (tribord) | Le milieu du chenal | Le bord situé sur sa gauche (bâbord)	A	RIPAM règle 9 : il serre, dans la mesure du possible et sans danger, le bord extérieur du chenal situé sur SA droite (tribord).	RIPAM règle 9 — Chenaux étroits	https://www.legifrance.gouv.fr/loda/id/JORFTEXT000000305722/		
q-fr-ripam-5-3b85413f	fr	regles_route	rule_mc	affirmative	Deux navires à moteur font des routes directement opposées (face à face) avec risque d'abordage. Que doit faire chacun d'eux ?	Chacun vient sur tribord | Chacun vient sur bâbord | Le plus rapide s'écarte, l'autre garde son cap	A	RIPAM règle 14 : chacun vient sur TRIBORD pour passer bâbord sur bâbord.	RIPAM règle 14 — Navires faisant des routes opposées	https://www.legifrance.gouv.fr/loda/id/JORFTEXT000000305722/		
q-fr-ripam-6-da4bb098	fr	regles_route	rule_mc	affirmative	Deux navires à moteur suivent des routes qui se croisent avec risque d'abordage. Lequel doit s'écarter ?	Celui qui a l'autre sur son tribord | Celui qui a l'autre sur son bâbord | Le plus grand des deux navires	A	RIPAM règle 15 : le navire qui voit l'autre sur SON tribord doit s'en écarter ; l'autre (le privilégié) maintient cap et vitesse.	RIPAM règle 15 — Routes qui se croisent	https://www.legifrance.gouv.fr/loda/id/JORFTEXT000000305722/		
q-fr-ripam-7-6cfa8ced	fr	regles_route	rule_mc	affirmative	Un navire en rattrape un autre. Qui doit s'écarter ?	Le navire qui rattrape | Le navire rattrapé | Toujours le voilier	A	RIPAM règle 13 : le navire RATTRAPANT doit s'écarter du navire rattrapé, quelle que soit la nature des deux navires (même un voilier rattrapant un navire à moteur).	RIPAM règle 13 — Navire qui en rattrape un autre	https://www.legifrance.gouv.fr/loda/id/JORFTEXT000000305722/		
q-fr-ripam-8-99164eff	fr	regles_route	rule_mc	affirmative	En l'absence de rattrapage et hors chenal étroit, un navire à moteur rencontre un voilier en train de naviguer à la voile. Qui s'écarte ?	Le navire à moteur | Le voilier | Aucun, ils gardent leur cap	A	RIPAM règle 18 : le navire à moteur doit s'écarter de la route du voilier (sous voiles).	RIPAM règle 18 — Responsabilités réciproques	https://www.legifrance.gouv.fr/loda/id/JORFTEXT000000305722/		
q-fr-ripam-9-a5491d8e	fr	regles_route	rule_mc	affirmative	Vous êtes le navire « privilégié » qui doit maintenir cap et vitesse, mais l'autre ne manœuvre pas et l'abordage devient imminent. Que pouvez-vous faire ?	Manœuvrer pour éviter seul l'abordage | Garder le cap et la vitesse quoi qu'il arrive | Accélérer pour passer devant	A	RIPAM règle 17 : si l'autre n'agit pas, le privilégié peut puis doit manœuvrer pour éviter seul l'abordage.	RIPAM règle 17 — Navire privilégié	https://www.legifrance.gouv.fr/loda/id/JORFTEXT000000305722/		
q-fr-decret2007-16-e2bd606e	fr	securite	rule_mc	affirmative	Jusqu'à quelle distance d'un abri le permis plaisance option côtière autorise-t-il la navigation ?	6 milles nautiques | 2 milles nautiques | Sans aucune limite de distance	A	L'option côtière autorise la navigation jusqu'à 6 milles nautiques d'un abri, de jour comme de nuit, quelle que soit la puissance.	Décret n° 2007-1167 du 2 août 2007, art. 2 — portée de l'option côtière (6 milles)	https://www.legifrance.gouv.fr/loda/id/JORFTEXT000000648362/		
q-fr-directive201353-18-90abdaaf	fr	securite	rule_mc	affirmative	À quel programme de navigation correspond la catégorie de conception « C » d'un bateau de plaisance ?	À proximité de la côte (force 6, vagues 2 m) | En haute mer sans restriction | En eaux abritées uniquement	A	Catégorie C = « à proximité de la côte » : conçue pour un vent jusqu'à force 6 et des vagues jusqu'à 2 m. (A = haute mer, B = au large, D = eaux abritées.)	Directive 2013/53/UE, annexe I, partie A — catégories de conception (C : force 6, vagues 2 m)	https://eur-lex.europa.eu/legal-content/FR/TXT/?uri=CELEX:32013L0053		
q-fr-division240-17-0d653305	fr	securite	rule_mc	affirmative	Pour la navigation côtière (jusqu'à 6 milles d'un abri), quelle flottabilité minimale doit avoir l'équipement individuel de flottabilité (brassière) selon la Division 240 ?	100 N | 50 N | 10 N	A	Division 240 : au moins 100 newtons pour la zone côtière (au-delà de 2 et jusqu'à 6 milles) ; 50 N en basique, 150 N au hauturier.	Division 240, art. 240-2.04 §3 — EIF niveau 100 (zone côtière 2–6 MN)	https://www.mer.gouv.fr/la-division-240		
q-fr-division240-19-b43bc920	fr	securite	rule_mc	affirmative	Combien de personnes peut-on légalement embarquer à bord d'un bateau de plaisance ?	Le nombre maximal fixé par le constructeur | Autant qu'il y a de gilets à bord | Aucune limite en mer	A	Au maximum le nombre fixé par le constructeur, indiqué sur la plaque signalétique / la catégorie de conception du bateau.	Division 240, art. 240-2.01 §1 — nombre maximal de personnes (plaque constructeur)	https://www.mer.gouv.fr/la-division-240		
q-fr-division240-35-ff7a899c	fr	securite	rule_mc	affirmative	Sur un bateau à moteur conduit à la barre franche, pourquoi le conducteur doit-il porter le coupe-circuit (cordon) relié à lui ?	Il coupe le moteur si le conducteur tombe à l'eau | Il augmente la vitesse du moteur | Il sert d'antivol au port	A	En cas de chute à l'eau, le cordon se détache et coupe aussitôt le moteur : le bateau ne part pas seul et ne blesse pas l'homme à la mer.	Division 240, art. 240-2.01 §7 — coupe-circuit (barre franche / déporté / VNM)	https://www.mer.gouv.fr/la-division-240		
